business_id,business_name,city,state,categories,review_id,clean_text,date,review_stars,review_length
MMRRS6YhVRx_iN5-JhMRYg,Han Dynasty,Philadelphia,PA,"Restaurants, Chinese, Szechuan",3MuS0y45t6xaewzh5bq6eg,one of my favorite restaurants for everything i have taken out dined in with small group and dined in with a large group the university city han dynasty has a great atmosphere and great food my favorite dishes and need to try at least once are the dan dan noodles spicy with peanuty taste cumin chicken chicken and onions and eggplant with garlic sauce i unashamedly have tried almost everything else even did the chefs tasting course with a group and have enjoyed everything the tastes are authentic and the flavors are great i do love spicy food though so make sure to ask for lower levels of spice if you are worried like the others the service is iffy usually the waiters and waitresses are too occupied and may take a while longer to get to you however when they do they are nice and helpful i would watch out for the huge lunch and dinner rushes,2016-11-22 16:31:16,5,158
PqPZQp2yh96LXWklR47mSA,Kohl's,Sparks,NV,"Furniture Stores, Fashion, Women's Clothing, Shopping, Shoe Stores, Cosmetics & Beauty Supply, Beauty & Spas, Jewelry, Department Stores, Home & Garden, Men's Clothing",nOHDgiqAIbf7FOoIvadT5A,kohls is a decent place i would much rather be able to afford shopping at some higher end stores but for the prices and the coupons that they send out you cant beat it i love their housewares and am always finding good stuff i buy a lot of my sons clothes there they have a good variety and like i said you should never pay full price at kohls there is always a coupon out for 1520 or 30 off i am not a fan of the womens clothes and that is why i did not give out five stars i just think a lot of them are drab and oldladyish it is in a very convenient location and the service has always been friendly,2013-03-21 21:50:22,4,126
dISs1oH_xeNAOOEcmJiGZQ,Cajun Kate's,Boothwyn,PA,"Food, Restaurants, Cajun/Creole",Ir0fw-0FBFsWpz9O4ChBNQ,we went here the other night even though it was 30 minutes before closing there was a sizable crown both eating and waiting for food in spite of the crowds we got our food very quickly i got the crawfish pie and half an oyster po boy the pie was delicious and the po boy was transcendent it was to date one of the best ive had i would definitely recommend this place if you want to get your cajun on,2016-05-07 12:55:35,5,81
M0r9lUn2gLFYgIwIfG8-bQ,Baileys' Range,Saint Louis,MO,"Ice Cream & Frozen Yogurt, Burgers, Food, Nightlife, Beer Bar, Bars, Restaurants",rP14DD68zsDLzPN3ZiNgyw,i was not impressed with much here ordered the longhorn and fries firstly they two beers that my friend and i wanted to try were out we were served room temperature water and the bottled soda i ordered was also room temp the burgers are small and didnt really taste better than something i could make at home lacking in flavor and overall taste he ambiance is nice but i was disappointed overall by the burgers the best thing i ordered was the peanut butter ice cream,2015-12-22 06:15:09,2,87
t5RIuLUvE5fxr0TaRWxeQg,Il Tartufo,Philadelphia,PA,"Italian, Restaurants",gQAGq-1DIth2Ayyy2wK2JQ,groupon helped me afford this place baked eggplant was excellent but the steak failed badly it was pretty much uncooked perhaps it could pass as rare but it was one hundred percent red and had the consistency of tuna tartare i even asked for it well done aside from the terrible steak the polenta on the side at least was great and i asked for a many a refill on bread to compensate for my loss as far as other things go the service was great but the seating was a bit cramped avoid getting seated in the middle tables as you will pretty much have no privacy,2012-04-03 07:35:16,3,108
YgMZm_alGFUeQO4hz9X9VA,Earl's New American,New Hope,PA,"Nightlife, American (New), Bars, Seafood, Restaurants, Wine Bars, Cocktail Bars",k-tQLC3YhNc6rQs_wfHqsA,we stayed at peddlers village for a wedding decided we liked the looks of earls we went in just as lunch was ending but before dinner we were told we could make a reservation for 30 minutes later and come back a little strange we thought the woman at the desk seems to think she is the gate keeper much like the soup nazi lol we returned as instructed and waited with six other groups for the clock to read precisely 5pm at 5pm she asked who had reservations even with the restaurant empty and sat us all in order of reservations then non reservationsshe made a very loud general announcement to this effect we all chuckled amongst ourselves oh and the food was good,2018-01-21 17:15:02,3,125
UCMSWPqzXjd7QHq7v8PJjQ,Prep & Pastry,Tucson,AZ,"Restaurants, Cocktail Bars, Bars, Comfort Food, American (New), Sandwiches, Nightlife, Breakfast & Brunch",Hpgccg0LL-agCxKMrbnb-A,yum literally thats all i can say about this place i went twice in one weekend im literally obsessed so where do i begin the doughssants or cronuts as some people prefer how yummy i had the cranberry and coconut one theyre very dense so get one before your meal bc i could only take one bite out of mine after i finished my grilled cheese oh man that grilled cheese they have a really unique blend of cheeses and pesto now i am not a pesto fan i know very strange but it works great here but the selling point is the tomato basil soup literally the best i have ever had and this is my favorite soup so i have tried it everywhere the second time i tried the classic breakfast 2 eggs any style i opted for scrambled country hash delicious and toast this time i had my doughssant beforehand smores flavored amazeballs the space is very comfortable and beautifully decorated the staff is extremely friendly always checking in with you and making lighthearted and sincere conversation there is a wait to be seated but you just have to stick it out because you dont want to miss out on this new restaurant ill be back when they get their liquor license business straightened out so i can sip on a mimosa while i enjoy my grilled cheese,2014-05-07 20:31:51,4,231
NL-pATcAaXHwxrm7ODwEig,Village Inn,Tampa,FL,"American (Traditional), Breakfast & Brunch, Restaurants",plfLREve60KckUlcBE2-yw,listen if kekes up the street can handle a massive line out the door and still have great service and food delivery at the perfect time the village inn can also get it together and provide the same service they need better management even though we did get the bill paid for by her we werent looking for a hand out we were looking for great tasting food as well as a taste of their pies which they claim to be known for again with a change of menu cooks and management this place and totally be eclectic fun and interesting there was a server we saw that was awesome she was on point and organized we wished we did have her but instead we ended up with a young lady who really didnt want to work today i get it but you are working in a industry that is brutal and your customer service and organizational skills is important,2017-12-30 17:51:56,1,160
FHNIvNgh3fS7VZQq2Y3dsA,Cheu Noodle Bar,Philadelphia,PA,"Asian Fusion, Tapas/Small Plates, American (New), Restaurants, Vietnamese, Korean, Noodles, Ramen, Japanese",Sl5-lA7Sg1pafwtuD8h1kw,this place is amazing everyone must try the matzo ball with brisket noodle soup the brisket is super tender the meat just falls apart after you put it in your mouth the slightly spicy soup seeps into the matzo ball giving it the most flavorful taste lastly the noodles were perfectly cooked it was al dente and not too soft like most asian noodle soups it was so good i forgot to take a photo we also had the dumplings in chili oil reminded me more of a ravioli than a chinese dumpling but i loved it wasnt too spicy and the dumpling skin was nice and chewy another dish we had and of course loved was the pork belly rice bowl its a katsu so the pork belly is slightly breaded and fried oh my the pork was sooooo tender the sushi rice they used paired perfectly with the pork and the katsu sauce they used im drooling just thinking about it if you get this dish id recommend adding some of the hot chili oil they give you on the table gives the dish a little bit of a kick im definitely going back to this place,2015-05-29 22:02:10,5,199
8G4mt9y5mRg161XBs-hePw,Izakaya Ren,Valley Park,MO,"Food, Korean, Sushi Bars, Restaurants, Japanese",cM7DtUxyvRBaPAoHl5T7YQ,love this place the sushi is delicious so fresh so yummy you can bring your nonsushi eating friends their noodle bowls are delicious too the service is great and the stuff is friendly i love that i dont have to drive into the city for great sushi,2014-07-29 12:57:05,5,47
2kuhZOrWcLYe_XePccr4lA,Cappy's Pizzeria- Seminole Heights,Tampa,FL,"Restaurants, Food, Pizza",MnGulkrquXU-qX7BrEaNPA,seated right away on a friday night excellent greek salad bread sticks and cappys style new york pizza soooooo good dare i say best in tampa first visit was a success,2016-02-27 02:11:49,5,31
zJErbOQMKX-MwHs_ulV7DA,Philadelphia Marriott Old City,Philadelphia,PA,"Event Planning & Services, Hotels, Hotels & Travel, Venues & Event Spaces",-VJNHZpQc8pJhYcuBHBPPQ,perfect location if staying in philadelphia during the fourth of july week because the fireworks display is within easy walking distance this hotel is close to the historic district and there is a farmers market here cobblestoned streets maritime museum jazz clubs decor is a bit yuck but hey location worked well,2006-05-28 11:22:11,4,52
w5VWdlVKW8FPF6AFk2JrOg,Days Inn by Wyndham New Orleans Airport,Kenner,LA,"Hotels & Travel, Event Planning & Services, Hotels",Qo_L4WyQss_dArVWwol5ag,i stayed at this location on 111015 my friend and i picked it for the location and the price its right across the street from the airport and we paid about 75 for the night so super easy to make and early flight the next morning check in was easy and they also had a room available earlier than the 3pm check in time so i was very happy the room was spacious and beds semi comfy overall my stay here was ok however never stay in the back of the hotel complex we had room 236 theres a train that passes probably almost every hour and unless your a sound sleeper this may not bother you but for me i had to download a white noise app and sleep with headphones in and i could still hear the train a little check out was easy and the staff was nice so i would recommend this place and probably stay again just not in the back of he building,2015-11-21 13:35:54,3,169
1UNorskttXSWuEcgzKzXcA,Xochitl,Philadelphia,PA,"Lounges, Restaurants, Asian Fusion, Mexican, Latin American, Nightlife, Bars",HF_y1XtmNOabmtJma25-Pg,im a fan of the margaritas and the sopas appetizers at xochitl the bartenders are nice the place has a fun atmosphere its clean and well run we always have a great time here the guacamole is delicious and homemade,2010-01-22 04:07:16,4,40
V6Om7YZhlRQRU7WfuxHq8Q,Beck's Cajun Cafe,Philadelphia,PA,"Restaurants, Cajun/Creole",r2qUGxJX7--apkq7wuV1aw,one of my goals for my trip to philadelphia was to visit reading terminal the place is filled with great options for food i was leaning towards the southern food so it was either the fried chicken place deliah or the cajun cafe i have been to new orleans a couple of times so i decided to try the cajun cafe to see how the food matched up the oyster po boy was great the oysters were friend nicely not too greasy the mayo pickles and tomato were in good balance the bread had a nice chewiness to it as well i really enjoyed the po boy it brought back some memories of new orleans prekatrina i also had an order of the jambalaya just cooked within an hour and brought it back to the hotel there was a nice spiciness which was not overpowering jambalaya,2010-03-20 23:41:07,4,146
7GWalbU5_1bRZ6BpZQB6lg,Verizon,Kirkwood,MO,"Home Services, Internet Service Providers, Professional Services, Mobile Phones, Electronics, Shopping",D_dGS-CzGfxCByhhlsG7mQ,never in my life have i had such horrible customer service this place sucks and the phone service sucks i can not get service at the place i work at went to kirkwood verizon store no help at all i was told thats verizon for service and the so called manager dumb as a box of rocks,2013-10-07 11:08:32,1,57
k0StgZ2DwBeEB5MXYnwfVw,Audubon Village-Cortland,Tampa,FL,"Real Estate, Home Services, Apartments",GPtOcFXdksOhYwx3RTNyBA,i lived here for a year i paid my rent early every month i moved in my apartment smelled very bad they had an odor system connected to get rid of it when i walked in with the leasing agent i noticed scratches on the hardwood floor stains on the kitchen cooktop walls had scratches etc i wrote all this down on the new tenant walk thru paper work and it got signed by the leasing agent i had to submit a few work orders to get most of it done i am pretty easy going person so i went ahead and did it i was happy to be in my new apartment i really never had any issues so i never required the office attention i had a few issues like the light bolts dying on me roaches and they took care of it i am pretty easy going but when i moved in i went and clean my apartment and left everything spotless i had pictures to prove it as well a few days later i get an invoice i am being charge for the cooktop and scratches on the hardwood floor which i notated on my walk thru paper work which i still had since i work a lot i sent my mother to talk to the property manager xhevaire mccool my mother is the most educated person i met she grew up in the catholic church so she is very respectful and proper with everyone even rude people such as the manager the manager barely paid any attention to her when my mother asked for a copy of the walk thru paper the manager said she was missing page 1 i know right to our advantage i always file all the important paper work so i had a signed copy myself she bought that with her the manager said she will contact her corporate office so chelsea corporate agent who was very nice and professional fix it the main reason i am writing this review is because the lack of professionalism how did they loose page 1 of the walk thru dont they usually keep a file with all that information also why will they try to charge me for something that was clearly marked on the walk thru paper work come on they knew that was there on top of that i had proof that it was there when i moved in when i spoke to chelsea at the corporate office she indeed made it better and fixed it to the best of her abilities and i am grateful for that but i still cant recommend that place i dont appreciate the fact that the office people are so helpless specially the manager if you are to move there please make sure you use a magnifier and check every area of the apartment including the floor make sure you write down every scratch every paint missing or issue i am very glad i did or i had to pay my 300 deposit and 592 on top of that for the scratches on the floor and cooktop damage that was already there when i got the apartment i do want to thank chelsea at the corporate office for all her help she was very knowledgeable of her job and she helped me out as much as she could she understood why i was upset about the fact that the manager was trying to rip me off and charge me for damage i did not caused i greatly appreciate that cheers jackie,2017-07-19 20:47:30,1,595
UuWNE12-HI-4UPilREGX5g,Masami Japanese Steakhouse & Sushi Bar,Drexel Hill,PA,"Restaurants, Sushi Bars, Japanese, Steakhouses",BT8K9EQfAlZjYvBUdwzamw,i ordered a bento box for takeout and it was delicious my wife at suggested that a bento box would be an interesting and new way to experience japanese food i googled bento box nearby and bussemey japanese steakhouse came up as one of the options i ordered online and the wait time was approximately 20 minutes when i arrived the food was ready and piping hot it was absolutely delicious i will be ordering from masami again in the future,2018-07-17 00:57:05,5,81
WVX0JKV9ZP-r9bz0A4xAVw,Berry Barn,Dover,FL,"Food, Fruits & Veggies, Specialty Food",-98g_iLKomh06OuawRLQ3g,we loved the strawberry shortcake with whip cream and the strawberry pizza it tasted so fresh and delicious they didnt have much produce because they were closing down for the season we really enjoyed the sweets i would recommend it to anyone,2018-03-24 18:24:29,4,42
9oHV5DAP88al74DKidIy-A,Drury Inn & Suites St. Louis Fenton,Fenton,MO,"Hotels, Hotels & Travel, Event Planning & Services",ojWQZFZUlti1WogRcAxrsw,this was a great hotel the breakfast was great they have a feature known as 530 kickback which is like a dinner and you would think its not that great but their hot dogs and mac and cheese were great the hotel is modern and clean and the staff were kind and professional it also had nfl network and tnt and espn for watching nba playoffs,2015-05-15 02:17:18,5,66
eJFw8xWcqyAno0SclR4uzg,Madison's Grill,Edmonton,AB,"American (New), Restaurants, Canadian (New), Breakfast & Brunch",OCcV3VFYotCLBHYNA6ATFA,went recently for a birthday party and it was certainly worth checking out was my first time there and i was pleased for sure was nice and quiet as it was a tuesday and the service was good because of that im sure it normally is though based on the size of the place i had beef n lobster which both were cooked well and i was happy also the mashed and asparagus that came with it were both very good i wasnt to stoked with the appy we had which was these crab and cheese balls as they were very bland with little crab taste and no real seasoning it seemed maybe just not for me but i wouldnt recommend those also had creme brule which was solid and is get it again for sure overall id say four due to a couple things like the appy and the shaky table seriously so stupid to have that at a place that nice but id gladly go again and would tell friends to try it,2014-12-17 19:08:44,4,175
EDjEVzmoQVHzboFqC-M6Ew,Local Taco,Nashville,TN,"Food, Tex-Mex, Restaurants, Mexican, Breakfast & Brunch",DtZ42EMEG9nog0flZAz0Kg,stopped in for an early dinner on a friday oct 23 and the joint was empty while the drill is apparently that you order at the counter and then sit down we noticed that there was a small bar and asked if we could sit there the bartender seemed annoyed but indicated that we could we sat down and two wornout menus the laminate was peeling off and the menus were creased and wrinkled to the point that they were difficult to read were thrown down in front of us we decided to start with a cocktail the drink menu included red and white sangria i asked the bartender which she thought was better she responded tersely that they were out of sangria but then added that even if they werent out they both were good and it just depended upon individual taste okay then my wife then ordered a margarita and i ordered the lojito cocktail my wife liked the margarita but the lojito was too sweet for my taste and i suspect they use something other than the hand squeezed lime juice listed on the menu we ordered queso dip and it was quite good chips were light and crispy and the dip was the perfect consistency not enjoying the lojito i handed it off to my wife and selected one of the beers on the menu and tried to order it bartender then informs me that they dont have that beer and that the menu was really out of date rather then telling me the handful of beer options that were available she told me i should walk back up to the front and look at the bottles behind the front counter to see what they had okay then selected a beer all bottles no drafts and returned to my seat to order asked for a glass with the beer and when it was given to me i was told not to break it because they only had 3 for those people that wanted a glass with their beer okay then from there we ordered a trio of tacos and a couple of enchiladas food was served uberquickly by someone from the kitchen bartender eventually threw down a couple of sets of silverware in front of us and turned her attention back to a couple of regulars that had joined us at the bar enchiladas were very good but not really unique the tacos were a bit more creative and feature locally made soft flour tortillas the tortillas were definitely better than storebought but not as good as madetoorder or a good corn tortilla southern fried taco was my favorite local bbq taco was good but the bbq sauce was too strong and overpowered everything else while finishing up our meal we witnessed multiple interactions between the bartender and customers and it was clear that unless you are a regular that essentially kisses up to her the bartender has no interest in you or your dining experience maybe the food otherwise could have merited more stars our overall dining experience was meh at best,2015-10-24 13:51:45,2,517
qq6vsh6ZEshfv4mTdrjA0g,Magasin Kitchen,New Orleans,LA,"Imported Food, Food, Specialty Food, Ethnic Food, Restaurants, Vietnamese",A18ygG_ZdRcMvMj6cxNEhg,great location for anyone who works in the business district and wants some vietnamese for lunch however i ordered the pho here and really regretted it the broth was horrible all water and no flavor and they really skimped out on the portion of meat being vietnamese i really should have known better and ordered something else but i just couldnt resist as i heard so much good things about this place from my american friends in short for all my vietnamese brothers and sisters out there do not order the pho as it is nowhere near on the level or standards were used too if you come here i recommend the bim bop curry or something on the vermicelli side as for pricing its a place in downtown so dont expect reasonable pricing were used to however for all my american friends out therethis place is great d,2016-07-04 17:43:40,2,149
LHSTtnW3YHCeUkRDGyJOyw,Fries Rebellion,Quakertown,PA,"Beer Bar, Bars, American (New), Gastropubs, Restaurants, Nightlife, Burgers",SS2wBEgAye6YwbTvHCO5VQ,excellent menu and beer selection will definitely go again apps of fried pickles were perfect the beer cheese sauce for the pretzels was amazing lots of burgers to chose from they were cooked as ordered homemade ketchup we got fried peanut butter balls for dessert that were surprisingly good,2015-09-12 20:17:14,5,49
7lwe7n-Yc-V9E_HfLAeylg,Pub & Kitchen,Philadelphia,PA,"Restaurants, Pubs, Food, Bars, American (New), Nightlife",BVhevuwoLytWwD-m5xycqw,unfortunately the delicious food was marred by the terrible service the waitress we had was perhaps one of the rudest ive encountered in a while it started when my boyfriend and i decided to order the kolsch which happens to be our favorite beer despite being the cheapest on the menu and in a can the waitress response when we ordered thisum really she also asked us 4 times if we wanted a glass with itshe finally brought the beers out with some glasses and asked again if we needed a glass yes we said again she then attempted to pour the beer into the glass while it fizzed all over and told us she was a bad at pouring beer just give me the glass ill pour it myself i told her good was her response the food however was delicious both the mussels and the skate were awesome i would have stayed for dessert and more drinks if the waitress hadnt brought us over our check immediately after we finished dinner without asking us if there was anything else wed like ill definitely be back here but avoid the rude waitress section,2013-08-05 14:15:33,3,194
5AOkxsg6UJQ_CoJTMBDUmQ,Ralph's on the Park,New Orleans,LA,"American (New), Restaurants, Cajun/Creole",CWaVKflMVWFx5yK4eZT6ng,all was wonderful with the exception of the turtle soup wasnt the typical brennan family batch three of us ordered it as a normal staple and we must have really caught them in an off night sherry couldnt help otherwise great atmosphere food and service,2016-11-24 10:45:22,4,45
DsKzHnkLKnxZTVsFpts4oA,Red Owl Tavern,Philadelphia,PA,"Breakfast & Brunch, American (New), Restaurants",ofhN1yBqtv36uGWSKQdgDQ,it was hot and humid so we came in here to avoid the heat and grab some lunch chicken salad sandwich was very tasty and kale and quinoa salad was enjoyed by someone in our group we were seated promptly and served in a timely fashion great place to grab a bite while on your feet all day sightseeing,2016-06-23 07:30:28,4,59
3c9TiufCFT2yXXj3R08Vwg,Snellgroves Restaurant,Plant City,FL,"Southern, American (New), Breakfast & Brunch, Restaurants",0TduQv9t7xhMfJlIg-L6DA,the cuban sandwich was good and the place is clean but the price was a bit high for what we got they need to offer fries with their sandwiches people dont expect to pay extra nowadays the salad bar was not worth the money and come on what salad bar dont have bacon bits or croutons simply terrible the waitress acted like she was doing a favor just serving us she was grumpy and slow and had a poor attitude when asked about the food i would not recommend coming here not with the fabulous whistle stop dinner just down the street highly disappointing,2017-10-02 23:59:33,2,104
