business_id,business_name,city,state,categories,review_id,clean_text,date,review_stars,review_length
j8JOZvfeHEfUWq3gEz6ABQ,Bacchanal Fine Wine & Spirits,New Orleans,LA,"Jazz & Blues, Bars, Arts & Entertainment, Beer, Wine & Spirits, Wine Bars, Food, Nightlife",eWQS1_qTNtXZ79gl1G1kcA,bacchanal is a fun spot to meet friends they have a great outdoor section and an awesome wine selection we ordered tapas and really enjoyed the smoked shrimp dip,2017-08-30 01:40:45,4,29
_E0WPHfJEYmwOUCAj-Jq1A,Western Village Inn and Casino,Sparks,NV,"Casinos, Hotels, Arts & Entertainment, American (New), Restaurants, Event Planning & Services, Hotels & Travel",TsgCEDzHc4dW_3fP5HKT3w,had a great 2 night stay here plenty of parking great food options in house and the mrs hit the slots for a bit as well our room was very well kept and very spacious well definitely stay again when we get out that way,2015-06-22 15:26:49,5,45
VD2jA3aLp8MfR8BiWWKs0w,Cotoletta,Belmont Hills,PA,"Salad, Italian, Restaurants, Seafood, Pizza",sVtFC5vg34WCzIQ-Oi6ijg,had dinner here with friends tonight and everyone agreed that it was wonderful the food itself was delicious most notably the stuffed long hots chicken milanese and the meatballs the staff was so friendly and accommodating and service was impeccable the owner stopped by our table and introduced herself and she could not be any nicer we will definitely be back soon,2017-05-27 23:58:27,5,62
cx5rIVMN-FXwBkl2Kbot7w,North 30th Sports Pub & Grille,Tampa,FL,"Nightlife, Sports Bars, Bars, Restaurants, American (Traditional)",WdYorUCBcKHZV-cu65qSBg,we stayed at the holiday inn right next to north 30th and decided to head there for dinner after a long day at busch gardens great sports bar very clean lots of tvs showing all different sporting events staff was very friendly and we had nice quick service food was good and we were all very happywe hung around for a bit after finishing our meal and had a few drinks which were well made and much needed after dealing with our kids at the theme park all day we had our own liquor in our hotel room however we enjoyed the setting here and did not want to go back to our room just yet so it was nice to sit and enjoy our drinks without feeling rushed to leave will definitely eat here again the next time we are in tampa,2018-07-08 17:19:58,5,143
iKeEhlGU9R8vUchNwF5__Q,Dewey's Pizza,Edwardsville,IL,"Restaurants, Pizza, Italian, Salad, Gluten-Free",jS_1QxVolId6tqOo6V8Aew,went here to eat and were very impressed had a harvest saladwhich was excellent we had a pizza that was half mushroom the other was the bronx bomberthey had a totally different taste from one anotherbut thats what made it so good the staff was quite friendly and our waitress was very knowledgeable on their productwe will definitely be back,2015-10-10 15:35:06,5,60
UCMSWPqzXjd7QHq7v8PJjQ,Prep & Pastry,Tucson,AZ,"Restaurants, Cocktail Bars, Bars, Comfort Food, American (New), Sandwiches, Nightlife, Breakfast & Brunch",8coeWfB5d7T5D9P9Ss-ziQ,this place is amazing delicious mimosas food and pastries best place for breakfast in tuscon and you can join waitlist online try it you wont be disappointed,2017-12-18 01:26:08,5,27
HdxKEFAKkdyWlVrAkuMvlg,Public Storage,Tucson,AZ,"Local Services, Self Storage, Sewing & Alterations",hWi_DUjtdzMBxdHQ_6cq7Q,i called public storage in tucson and reserved a climate controlled unit at this location when i arrived with the truck i had just driven alone from nc to tucson that was full of furniture i was told i did not reserve climate controlled the two ladies in the officeaysha and im not sure the other ones name that was there at the timeacted like they had no idea of anything at all or what went wrong they offered to let me take a unit twice as large much larger than i needed at twice the price i drove to the other location to speak in person with the person who i had spoken with on the phone to make the reservation even though we had said climate controlled multiple times i thought perhaps he had made a mistake on the reservation and could help me out other than offering me that unit at twice the price or a unit too small for my stuff this location wouldnt offer anything when i arrived he said he remembered me and double checked my reservationconfirming as i thought that it was for climate controlled when he called the houghton location they told him that when my reservation was made they came back with another customer who wanted a climate controlled unit and gave her mine at that time they changed my reservation so not only did they 1 give away a unit for which i had a confirmed reservation but they also 2 changed my reservation without notifying me 3 lied to me about my reservation and pretended they knew nothing when both of them were clearly perfectly aware of what they had done 4 offered nothing but to make me pay double for a years worth of storage to pay them for lying to me and taking away my reservation honestly to the poster below if you were the end of this may it makes me wonder if my reserved unit is the one that suddenly became available i did not arrive outside of my reservation window came in the same day it was made and didnt cancel it or do anything that would have made it available but it was given to another customer,2013-06-06 00:12:56,1,374
qKTjtjNSHNj8g2ugXlmkTA,Kitchen Conservatory,Saint Louis,MO,"Education, Cooking Schools, Home & Garden, Shopping, Kitchen Supplies, Specialty Schools, Kitchen & Bath",6aqvsRTYAjcb29QG62QY-w,this review is of a cooking class my husband and i took here we received a gift certificate and were able to attend any class of our choice they have a huge selection of classes and things to make we chose a paella date night class we were taught the recipes to make sangria a seafood paella and a chicken paella first of all for some reason i pictured going into a home ec type situation with individual kitchens and tools that is not the case they have two kitchens but a different class is being offered in each kitchen the process for what you are cooking is explained step by step but you only participate in one or two steps the class had over 15 people in it and so each person is delegated small tasks one person peels the potatoes and another person slices it one person mans the oven and another person squeezes lemons etc i must say that this disappointed me because you really dont lean many if any skills this way the instructor did not really explain how the proper way to do said task was unless you were doing it incorrectly i am not sure if the class would have been different had an actual kitchen conservatory staff instructor was teaching it but we really didnt learn much from the chef the classes are quite pricey and while it was a fun experience i would not spend the money again because the take away is small i would recommend more individualized instruction and for more skills to be taught,2015-01-06 18:33:27,4,265
fk319T8iPMAGipSXBPFa0Q,Puglia's Sporting Goods,Metairie,LA,"Shopping, Archery, Active Life, Sporting Goods, Guns & Ammo, Outdoor Gear, Hunting & Fishing Supplies",mYsLByEy35H0OggRqBdFug,this is a great locally owned and operated sporting goods store that focuses primarily on hunting and fishing they have a limited selection of clothing items and frequently offer great sales on colombia fishing shirts if you need anything in the area of firearms or fishing equipment this place often has items that are difficult or impossible to find at other area stores,2012-12-07 18:46:45,4,63
xT41eqUSsM_MDE1Vjhq20A,SoFresh,Tampa,FL,"Gluten-Free, Food, American (Traditional), Wraps, Vegan, Juice Bars & Smoothies, Salad, American (New), Restaurants",LaovPkEdYTYqU2U9ZN9b7A,if youre looking for fast casual meal that is healthy and delicious this place is the spot the prices are great and everything is cooked to order so nothing is sitting around waiting for you to order the prices were great almost everything was 10 and that included hot chicken or tofu lunch was crowded and i waited about 10 minutes to get my meal so id call ahead if youre on a time crunch definitely using this place to drop a few pounds,2015-02-20 02:45:36,5,84
AWJyivVwe3t9BO-k8D0ynQ,Cafe Square One,Philadelphia,PA,"Food, Coffee & Tea, Cafes, Salad, Sandwiches, Sushi Bars, Restaurants, Breakfast & Brunch",cL09KbLXPNImlJhYaLZr5Q,you know when someone tries to do so many things that they cant really do any of them well thats exactly how i feel about cafe square one their menu is super extensive and they boast that you can pretty much make any accommodation you wish which is nice for those picky souls ive had an array of items here from salads to bagels and i wasnt very impressed with any of them service is friendly but very slow even when youre the only customer the smoothies are a solid 4stars though and i will certainly return for those,2015-07-18 17:29:14,3,99
vSQPjQYfMDBRS3bQ15zlGA,Siamese Princess,Ardmore,PA,"Restaurants, Thai",JBroDo2XE8iNIbh__4ne4Q,great thai food for a good price i love the small cozy atmosphere and the service is good the spring rolls and veggie rolls are delicious i like the salmon with apricot sauce the drunked noodles and the chicken is tender in all the dishes my favorite though is always getting the whole fishdelish,2012-05-03 15:48:23,4,54
zun6IVJa7wYe3wAPqWnPGw,PokeDoke,St. Louis,MO,"Sushi Bars, Bubble Tea, Hawaiian, Food, Poke, Restaurants",pb7E554hFFMjEcbMMUyoAw,i seriously love this place so fresh so yummy and such a great local business with very friendly staff great prices too i love that they have a lot of healthy options and nonsushi options like grilled chicken tofu and shrimp for weird people like my mom who dont like sushi thanks for bringing poke to st louis,2018-02-02 00:36:12,5,58
GBTPC53ZrG1ZBY3DT8Mbcw,Luke,New Orleans,LA,"German, Restaurants, Seafood, Cocktail Bars, French, Brasseries, American (New), Nightlife, Bars, Cajun/Creole, Breakfast & Brunch",-VzusjnASxsFnO7oPtv25Q,i went here for breakfastbrunch on a sunday morning service was great and it wasnt packed we had a group of 6 and they were able to seat us right away the menu was small and didnt have a ton of options but they had the breakfast basics and everything was of the highest quality with some picky eaters and 2 vegetarians in the group the limited menu still had something for everyone i highly recommend the jalapeo grits not spicy but great flavor,2014-01-19 19:42:54,4,84
D73evJ9PZKxO3E5TaThe3w,Superior Grill,New Orleans,LA,"Tex-Mex, Mexican, Restaurants",bO-nWIf6OnVpZtnX2MCVyQ,what is there to say that hasnt already been said forgive my redundancy the majority of food here isnt even texmexmaybe 1950s texmex plain cheese or meat only fillings with gobs of cheese on top they have changed the menu since i was last here to eatabout a year ago it now features some items with essentially no description eg chicken enchiladasno description of the sauce or toppings so what am i supposed to assume that it is just plain chicken rolled in a tortilla and served dry i asked what sauce it comes with and offered suggestions ranchero verde suizas the waiter then said oh yeah you want suizas well ok yes i like the suizas so thats what i got i still have no idea what sauce the enchiladas come with now and there are no indications on the menu that you would pick a sauce i would say most of the menu here is decenti have also enjoyed the fajitas quesadillas and tacos al carbon on occasion no it is certainly not an out of this world mexican restaurant but its not bad food by any means i find the salsa to be more than acceptable flavorful and fresh though mild and the queso is thin and slightly lacking in flavor but still hits the spotespecially compared to some of the other mexican restaurants in town most everything on the menu is overpriced but hey welcome to new orleans and get used to itthis wont be the first or last restaurant that meets that description the margaritas are only worth the price during happy hour mardi gras or cinco de mayo they are definitely strong but outside of happy hour or the convenience of them during mardi gras i wouldnt waste my time as they really dont taste very good being a texan i am of the distinct opinion that margaritas come only on the rocks but of course frozen are the most popular type here so people may enjoy the flavored frozen mixes more the best thing about superior grill is that they can handle a crowd i have attended and yes even hosted many a large party here work birthday girls nights etc with 20 people and they welcome it with no problem they also have a pretty consistent staff i recognized one of the waiters from the last time i was there a year ago that is almost always friendly if you have ever been here during mardi gras when they continue operating and serving food while the parades roll 20 feet away or cinco de mayo then you know it can get very busy and they still manage to negotiate servicea regular night is no big deal overall this is one of those new orleans nostalgia places for me and mostly holds a place in my heart for all of the well lubricated memories friends and i have enjoyed visit because you like strong drinks close stops to the streetcar and a nice patio to eat on but dont set your expectations too high for the cuisine,2012-05-31 00:41:24,3,514
rVfe1LHo55A2fworkm_jVw,Capofitto,Philadelphia,PA,"Bars, Gelato, Breakfast & Brunch, Italian, Food, Nightlife, Restaurants, Pizza",hIfcdDHSmVhypozBz0rWqQ,the best gelato and very good pizza we came between brunch and dinner so ate at bar had a bottle of the best pizza wineand likedit ordered two pizzas for the three of us plenty and i eat a lot of pizza pizza reminds me very much of vetri and similarly priced expensive excellent ingredients the style has a soft middle crust almost white and underdone to me which apparently is authentic otherwise i would ask for a little more well done but that might be an insult you tuck and fold the middle to eat i mean its delicious but i feel i shovel too much in that way and lose the individual taste of the fabulous toppings the outside crust was puffy and tender nice bartender service and he was really runnng around i think it was a surprisingly busy day downtown the gelato is always amazing im in a rut i always get the thai coconut and something chocolate or coffee some day i will have had my fill of coconut and try other flavors no i wont,2017-02-19 13:06:09,4,181
wn1rS1Ga9xZ1BIMffnJW5A,Applebee's Grill + Bar,Sicklerville,NJ,"Fast Food, Burgers, Nightlife, Bars, American (Traditional), Chicken Wings, Sports Bars, Steakhouses, Restaurants",T2hjVEzVvVOowpHYoc_sgA,ppl this is a chain you really think this is quality food and dining first of all your in sicklerville so stop however if you know what to expect you wont be disappointed have a seat at the bar service is usually great if your lucky enough to go when kristyn kristen or dee are working they are awesome friendly and make the subpar food experience much better,2016-03-19 21:02:30,4,68
REt83ozDeIl6fCYZuAjNrA,Tran's Chinese Food Cart,Philadelphia,PA,"Chinese, Food Stands, Food, Food Trucks, Restaurants",mJK8Z_O7OhQyxMO1gpiRpw,delicious cheap chinese food usually drop in about once a week a friend recommended a chicken egg foo young and im completely hooked its the only thing i order and i have no plans to change food and a drink for 5 is hard to beat,2014-04-22 14:23:42,5,46
37BpNvlEAT6WVGsksrHbBQ,Batter'd & Fried Boston Seafood House,Nashville,TN,"Sushi Bars, Fish & Chips, American (Traditional), Nightlife, Bars, Seafood, Pubs, Restaurants",t24cyMnixXJ9auOW-cD4kw,i am an honest reviewer and not a picky eater but i do so hate to pay for food i could make better at home andor is obviously from the freezer i dont care for pomp and ambiance if the food is lack luster this place was such a treat two for one oysters sushi and perfectly fried cod shrimp and some of the best onion rings i have ever had at a restaurant our food was out in 10 minutes and we paid less than you would at your normal run of the mill chain place ive already told friends about it and plan to go back next week,2017-10-25 14:41:59,5,110
O3JyUZS0wzsApHJ1h10Ndg,The HandleBar,Indianapolis,IN,"Hotels & Travel, Active Life, Pubs, Tours, Event Planning & Services, Nightlife, Bars, Party Bus Rentals, Bike Rentals",y0SvsFOscxtGplThbIqU7w,this is definitely a fun activity to do with friends family coworkers etc its definitely changed since i tried it the first time i went a few years ago and each stop was a bar so we really really enjoyed ourselves ha my second time 2 of the 4 stops were at the circle then the wwii monument not that it wasnt interesting it seemed kind disrespectful drinking at the war monument and when we were there it was memorial day weekend so all the flags were up i felt kind of uncomfortable i like the fact we do get to bring our own drinks and peddle and drink wish we stopped at more bars like we did my first go around but its still fun hopefully they rethink the wwii monument but besides that its reasonably priced a fun afternoon parking wise was also different than my first time we met at a bar instead of where they launch the handlebars wish they were more specific on where to park or where you can park some of us paid for parking and others didnt kind of all over the place regarding parking but once again very fun and i suggest trying it out,2017-10-11 00:59:45,3,204
2brttsiFBlW8070dsPzQDA,First Watch,Indianapolis,IN,"Breakfast & Brunch, Restaurants, Cafes, American (New), American (Traditional)",SwsT4cISmKKUgiNe9qh53w,service slow eggs benedict hollandaise out of a plastic packet or tub breakfast menu overall edible but meh best thing about it is a handy downtown location and at least they have some booths,2014-11-12 22:39:04,2,34
JUlsvVAvZvGHWFfkKm0nlg,El Camino Real,Philadelphia,PA,"Mexican, Tex-Mex, Restaurants, Barbeque",MD4QWUPIDvyU9nHzRoDgSw,if youre reading this update in isolation not in the sense that youre in solitary confinement but in the sense that youre not reading it along with my penang update i recommend you go to phillymonicayelpcom now as part of my morning goals for the day i promised i wouldnt drink or eat carbs but would instead opt for a salad and go to the gym while i did go to the gym i failed to not drink at lunch i downed 2 margaritas one with canton ginger liqueur instead of tequila and a cantonbourbonarita they were all so delicious i couldnt help but allow one to follow the other i did order a taco salad though great food but unsuccessful day folks better luck tomorrow,2009-06-11 01:48:43,5,126
7EhTT4iEuA7JaaWA-eI3Qw,Seasons Cafe & Bakery,Pinellas Park,FL,"Food, Bakeries, Asian Fusion, Vietnamese, Restaurants, Specialty Food, Delis, Sandwiches, Bubble Tea, Soup",hJB_tve8p_rDE2sGGooLhA,this place is pretty casual and quaint the prices are quite good for what you get they seemed a little understaffed maybe they offer a lot of good options and i asked the staff which one between the curry and the chicken chili paste and he recommended the chicken chili paste it only took a few minutes 510 for the food to come out we also got a crab rangoon appetizer the crab rangoon kind of had a strange taste to it not sure what it was but i didnt care for it much and didnt finish my other 2 pieces the chicken on the other hand was fantastic a large portion and it was delicious not too spicy with plenty of rice to go with it would definitely recommend this place in the future for good eats,2017-07-13 00:30:31,4,138
0ndzIekJs0PRPA5Aoz9sow,Morning Call Coffee Stand,Metairie,LA,"Coffee & Tea, Restaurants, Food",gzRPCTdsQuP0zfV8F4Eacg,hands down these are the best beignets in town you will go to cafe dumond just have been there but to enjoy really great beignets go to morning call,2013-10-27 05:14:29,5,29
IbndcMURguByburM72o3SA,State Street Kitchen,Newtown,PA,"Korean, American (Traditional), Sandwiches, Cheesesteaks, Restaurants, Coffee & Tea, Breakfast & Brunch, Food",bdyB-zyL4wACVuBCwg_vig,i had coffee and the pumpkin pecan hot cakes they were good service was good place is jam packed with your neighbor sitting right on top of you i dont see what all the fuss is about,2014-10-28 22:36:25,3,37
A21srfWbl97OWsCn2lK-0Q,El Gallo Grande,St. Petersburg,FL,"Beer, Wine & Spirits, Mexican, Bars, Food, Sports Bars, Restaurants, Nightlife, Specialty Food, Ethnic Food",JLtiG10eroKxBeyCyWw_3A,definite improvement we went here about a year ago and left disappointed we just went today and had great service and the food wasnt bad either had some house margaritas during happy hour and they werent the strongest but for 3 ill take it we also ordered a steak burrito and veggie platter with queso fundido as an appetizer next time yes next time well probably change it up and try the guacamole and fajitas my confidence has been restored a bit in this place the only major complaint i had was the salsa is just awful drinks appetizer and two entrees for a little over 30 not bad,2016-06-14 23:25:42,4,109
EDjEVzmoQVHzboFqC-M6Ew,Local Taco,Nashville,TN,"Food, Tex-Mex, Restaurants, Mexican, Breakfast & Brunch",48wp6qq1hZdbp4-mkDtFHA,perfect little place to stop in for good food and drinks for an even better price something you dont find everywhere the fish tacos were good not the best but for the price and how quickly they were prepared i was very happy my friends raved about their korean bbq tacos so if thats your type give em a try because you can at least know your wallet wont regret it the bar and inside area fills up quickly with a crowd but outside is where its at anyway they have it all set up without too much atmosphere so you and your friends can spread out,2014-05-07 23:03:58,4,107
KXjtXU59NsMTWuNwxIbFVg,Freedom Springs,Greenwood,IN,"Water Parks, Swimming Pools, Tubing, Active Life, Amusement Parks, Parks",ecm7PxAsyzph33BtSeBPOA,there are so many other city water parks out there that are more reasonable in price regardless we have patronized this park numerous times and for it just being the 2nd year of operation there have been several equipment failures seems like every time we visit something is broken wont be in operation for either hours or the entire day last sunday the kiddie water park and the smaller tubes were out of commission so the only venue now is the big swimming pool or the lazy river after an hour the lazy river looked like hundreds of refugees in floating ashore or one of those carnival duck games you choose which now the curious thing here is that you have a long wait in line only to be told after you have paid admission that one of the pools or the lazy river is out of commission for the day nice huh its almost like they train their teenaged employees to get the cash first then let em know the reality of the situation the food is expensive not terribly good all in all the city of greenwood is perpetuating a sort of highway robbery we are seniors who do not live in greenwood however we pay a non resident seniors price about 8 each2 more than greenwood seniors because obviously we must be more wealthy we have decided to explore other options around our area as this park is really kind of a ripoff buyer beware,2018-04-06 21:13:05,1,248
SKph9ovzvVSNzNFICgKb1Q,Union Burger,Clearwater,FL,"Restaurants, Burgers",RZcuGsFncyp4AO9eewuIxQ,fast food thats a cut above the usual franchise fare the bun bread is very tasty as are the burgers themselves and they offer mighty leaf teas which i personally like to see often any decent selection of tea is hard to find will return,2015-11-08 01:09:14,4,45
dNR-b-CsrFGYhMo9zLMrCw,Soy Bistro,Brentwood,TN,"Japanese, Korean, Asian Fusion, Tacos, Mexican, Restaurants",0pGm_lUwBrsEImNzBmy1EA,we were in town moving our son and decided to try it after an exhausting day moving it hit the spot it was fast offered delayed take out for our company too tired to eat out the food was fresh hot and great the takeout even arrived still heated very family friendly the staff was attentive and accommodating,2016-09-09 01:20:53,5,58
2XYPFRm7teCUr3eGsB2-qw,Thai Orchid,Blue Bell,PA,"Thai, Restaurants",RoxgjEalqu9zhu8z_w_PYg,i love this place i have been there handful of times this place definitely makes the best thai food in the area the portion is just right i asked them to make it spicy and it was spicy just the way i like it i go there often when i am in need of comfort food i have taken many friends there when they come to visit me and they all loved it you will not go wrong with this place,2013-07-13 22:57:42,5,81
6I_DA3uqOox50rBvjrQ_-g,Aloft Philadelphia Airport,Philadelphia,PA,"Event Planning & Services, Hotels & Travel, Hotels, Venues & Event Spaces",4loOxW44PjT0FpceRso_cA,the beds are too hard to get any sleep the food selection at the grab and go downstairs consists of wraps and stripped down premade salads if you want something else then the hotel next to aloft is the only option in walking distance and they have a flat top and a microwave so expect their food to have been cooked offsite frozen and reheated or just very greasy from the flat top cooking id love to review the design of the aloft room or the outlets all over in convient places but hey its 2am and i still cant sleep on my concrete mattress which was reminscent of my time in asia where some rural places would throw a blanket on the hardwood floor and call that a bed,2015-06-11 05:56:51,1,130
8uF-bhJFgT4Tn6DTb27viA,District Donuts Sliders Brew,New Orleans,LA,"Food, Donuts, Burgers, American (Traditional), Coffee & Tea, Restaurants",YhdPpMsAZS05lIHjlDCGCw,stopped in here before taking off to the airport the donuts are the size of my hand and delicious i had the muffuletta slider for lunch and it was to die for perfectly made and the donut was a nice change to the traditional caviars bread the staff was friendly and vibrant adding this one to my must list next time in nola,2015-11-22 23:22:46,5,63
